[
  {
    "id": "team-attached",
    "title": "Team attached (conductor)",
    "when": "tool-visible:team_delegate",
    "skills": [
      {
        "ref": "local/conductor-protocol"
      }
    ],
    "enabled": true
  },
  {
    "id": "git-repo",
    "title": "Inside a git repository",
    "when": "git-work-tree",
    "skills": [
      {
        "ref": "local/worktree-first"
      },
      {
        "ref": "mattpocock-skills/pr"
      },
      {
        "ref": "local/pr-always"
      },
      {
        "ref": "local/worktree-cleanup"
      },
      {
        "ref": "local/post-merge-sync"
      }
    ],
    "enabled": true
  },
  {
    "id": "recommended",
    "title": "Recommended everywhere",
    "when": "always",
    "skills": [
      {
        "ref": "humanlayer-skills/show-me"
      }
    ],
    "enabled": true
  }
]
